{"checkpoints":[{"edges":[{"id":"asks_about_brother","predicate":"trust >= 0.4","to":"reveal_gate","when":"the player has asked about their missing brother"},{"id":"turns_hostile","to":"failure","when":"the player threatens or insults Old Wei"}],"goal":"Size the stranger up; warm to them only if they explain why they are here","id":"suspicious_of_player","may_disclose":[]},{"edges":[{"id":"thanks","to":"success","when":"the player thanks Old Wei or says goodbye"}],"goal":"Tell the player the eastern gate is guarded, reluctantly","id":"reveal_gate","may_disclose":["eastern_gate"]}],"facts":[{"default":0,"key":"trust","type":"number"},{"key":"eastern_gate","type":"string"}],"id":"night_market_keepers","npcs":[{"id":"old_wei","languages":[{"code":"zh","comprehension":9,"speaking":9}],"name":"Old Wei","persona":"a retired ferryman who distrusts strangers"}],"pedagogy":"none","schema":"dialogue.v1","start":"suspicious_of_player","title":"The two keepers"}