{"checkpoints":[{"edges":[{"id":"alarm","predicate":"alarm_raised","to":"failure"},{"id":"explained","to":"ask_about_brother","when":"the player says who they are and why they are here"}],"goal":"Elena is wary and asks who the player is","id":"introduction","may_disclose":[]},{"edges":[{"id":"gate","predicate":"trust >= 0.4","to":"success","when":"the player asks where soldiers might take a prisoner"},{"id":"neighbour","to":"ask_tomas","when":"the player asks who else saw the soldiers"},{"id":"leaves","to":"abandoned","when":"the player walks away"}],"goal":"Admit she saw soldiers ride toward \"the old mill\"; reveal the gate only if she trusts the player","id":"ask_about_brother","may_disclose":["eastern_gate"]},{"edges":[{"id":"suspicious","predicate":"suspicion > 0.5","to":"failure"},{"id":"back_to_elena","to":"ask_about_brother","when":"the player returns to Elena with what Tomás said"}],"goal":"Tomás says the soldiers spoke of the road to 長安","id":"ask_tomas","may_disclose":[]}],"facts":[{"default":0,"key":"trust","type":"number"},{"default":0.4,"key":"suspicion","type":"number"},{"default":false,"key":"alarm_raised","type":"boolean"},{"key":"eastern_gate","type":"string"}],"id":"missing_brother","npcs":[{"id":"elena","languages":[{"code":"es","comprehension":9,"speaking":9},{"code":"en","comprehension":3,"speaking":2}],"name":"Elena","persona":"a farmer who distrusts soldiers"},{"id":"tomas","languages":[{"code":"es","comprehension":9,"speaking":9},{"code":"en","comprehension":7,"speaking":6}],"name":"Tomás","persona":"Elena's neighbour, a retired soldier"}],"pedagogy":"none","schema":"dialogue.v1","start":"introduction","title":"The missing brother"}